{
  "batches": [
    {
      "batch_id": "20260904000000",
      "errors": [],
      "expected_archive_sha256": "96bd98bec450ed7f8208e962bb4964c600a05fc90562552729369d6efc09d9ea",
      "first_archive_sha256": "96bd98bec450ed7f8208e962bb4964c600a05fc90562552729369d6efc09d9ea",
      "first_semantic_sha256": "ba9d0007bf8598a831c0ce32625015cf6fd8c942b3cf2fa1e814aeb2a989e06d",
      "second_archive_sha256": "96bd98bec450ed7f8208e962bb4964c600a05fc90562552729369d6efc09d9ea",
      "second_semantic_sha256": "ba9d0007bf8598a831c0ce32625015cf6fd8c942b3cf2fa1e814aeb2a989e06d",
      "status": "passed"
    },
    {
      "batch_id": "20260904001500",
      "errors": [],
      "expected_archive_sha256": "9af140aecec36608d289684152d74878af6d081e49bddf9447996e7300643a6f",
      "first_archive_sha256": "9af140aecec36608d289684152d74878af6d081e49bddf9447996e7300643a6f",
      "first_semantic_sha256": "324b9d07bf3fc38cd0e55b3e94a489a79368b899ba54d36b8a5e9165e0d265a9",
      "second_archive_sha256": "9af140aecec36608d289684152d74878af6d081e49bddf9447996e7300643a6f",
      "second_semantic_sha256": "324b9d07bf3fc38cd0e55b3e94a489a79368b899ba54d36b8a5e9165e0d265a9",
      "status": "passed"
    },
    {
      "batch_id": "20260904003000",
      "errors": [],
      "expected_archive_sha256": "04c33187b3f90c1ed4d86c910f967b5bd06c1803e3fbde4848d127113a8eec9e",
      "first_archive_sha256": "04c33187b3f90c1ed4d86c910f967b5bd06c1803e3fbde4848d127113a8eec9e",
      "first_semantic_sha256": "cfaeb835c681b6a2aeb40db61fad75123f289b22fe9e44e30c1abebff7b8d36d",
      "second_archive_sha256": "04c33187b3f90c1ed4d86c910f967b5bd06c1803e3fbde4848d127113a8eec9e",
      "second_semantic_sha256": "cfaeb835c681b6a2aeb40db61fad75123f289b22fe9e44e30c1abebff7b8d36d",
      "status": "passed"
    },
    {
      "batch_id": "20260904004500",
      "errors": [],
      "expected_archive_sha256": "e84387088b8a4f3fc27f997a548f187e2663142d79657cb1153666a3007e6583",
      "first_archive_sha256": "e84387088b8a4f3fc27f997a548f187e2663142d79657cb1153666a3007e6583",
      "first_semantic_sha256": "e5578de93b8b61f519a29f053a49b6bba1a7900b84730c933b58195480bcc457",
      "second_archive_sha256": "e84387088b8a4f3fc27f997a548f187e2663142d79657cb1153666a3007e6583",
      "second_semantic_sha256": "e5578de93b8b61f519a29f053a49b6bba1a7900b84730c933b58195480bcc457",
      "status": "passed"
    },
    {
      "batch_id": "20260904010000",
      "errors": [],
      "expected_archive_sha256": "57faf969dc89a0647a7338c8f13ded6f860523d91f2bc7bb4e7f11e521f8c7ab",
      "first_archive_sha256": "57faf969dc89a0647a7338c8f13ded6f860523d91f2bc7bb4e7f11e521f8c7ab",
      "first_semantic_sha256": "62db7b64ffb10defc85bc0aa0bee647bb635bf55dedf304db28a8dc3e7ca8610",
      "second_archive_sha256": "57faf969dc89a0647a7338c8f13ded6f860523d91f2bc7bb4e7f11e521f8c7ab",
      "second_semantic_sha256": "62db7b64ffb10defc85bc0aa0bee647bb635bf55dedf304db28a8dc3e7ca8610",
      "status": "passed"
    },
    {
      "batch_id": "20260904011500",
      "errors": [],
      "expected_archive_sha256": "b05cdeec5569986a9a64f8ff5e52c6d4bab1da19fa7fee4658f6ff456ee65cad",
      "first_archive_sha256": "b05cdeec5569986a9a64f8ff5e52c6d4bab1da19fa7fee4658f6ff456ee65cad",
      "first_semantic_sha256": "e9ea7a7f19400a396d14033ab2e44e48042160c87289deb5c3a9874a4317616a",
      "second_archive_sha256": "b05cdeec5569986a9a64f8ff5e52c6d4bab1da19fa7fee4658f6ff456ee65cad",
      "second_semantic_sha256": "e9ea7a7f19400a396d14033ab2e44e48042160c87289deb5c3a9874a4317616a",
      "status": "passed"
    },
    {
      "batch_id": "20260904013000",
      "errors": [],
      "expected_archive_sha256": "105cf44b42ca242d0778f187275117b74c8122d0e01019c8091c4873d07584e0",
      "first_archive_sha256": "105cf44b42ca242d0778f187275117b74c8122d0e01019c8091c4873d07584e0",
      "first_semantic_sha256": "3c1f5548e275eb6bbc76a70fc0620b3cd94aa728af8ebf0ec8f8a6a6d156b67e",
      "second_archive_sha256": "105cf44b42ca242d0778f187275117b74c8122d0e01019c8091c4873d07584e0",
      "second_semantic_sha256": "3c1f5548e275eb6bbc76a70fc0620b3cd94aa728af8ebf0ec8f8a6a6d156b67e",
      "status": "passed"
    },
    {
      "batch_id": "20260904014500",
      "errors": [],
      "expected_archive_sha256": "7d21148d7af4843be2c4c138f2f7608170b41a6de40acfc62058113f0fb8a87e",
      "first_archive_sha256": "7d21148d7af4843be2c4c138f2f7608170b41a6de40acfc62058113f0fb8a87e",
      "first_semantic_sha256": "19c7c62712534520f7060b99f880161f5b337c0fa96e4804ff3aee675c693900",
      "second_archive_sha256": "7d21148d7af4843be2c4c138f2f7608170b41a6de40acfc62058113f0fb8a87e",
      "second_semantic_sha256": "19c7c62712534520f7060b99f880161f5b337c0fa96e4804ff3aee675c693900",
      "status": "passed"
    },
    {
      "batch_id": "20260904020000",
      "errors": [],
      "expected_archive_sha256": "4ca593252b42c4cfa44938f98a2a227ce591e9cf2b31528e68b616b80f786c57",
      "first_archive_sha256": "4ca593252b42c4cfa44938f98a2a227ce591e9cf2b31528e68b616b80f786c57",
      "first_semantic_sha256": "e152f97251bad8b5b499f143ee0660bb2a6d18c3e0a347387d0cf2d847e02bc4",
      "second_archive_sha256": "4ca593252b42c4cfa44938f98a2a227ce591e9cf2b31528e68b616b80f786c57",
      "second_semantic_sha256": "e152f97251bad8b5b499f143ee0660bb2a6d18c3e0a347387d0cf2d847e02bc4",
      "status": "passed"
    },
    {
      "batch_id": "20260904021500",
      "errors": [],
      "expected_archive_sha256": "85a2ff8eb174bdcb2ccf99fc20da260c179475bfef37ba9f654120549b04fc76",
      "first_archive_sha256": "85a2ff8eb174bdcb2ccf99fc20da260c179475bfef37ba9f654120549b04fc76",
      "first_semantic_sha256": "a6219e380879da3178d393ed4be22b797808866922b43d160715aad9bfe24784",
      "second_archive_sha256": "85a2ff8eb174bdcb2ccf99fc20da260c179475bfef37ba9f654120549b04fc76",
      "second_semantic_sha256": "a6219e380879da3178d393ed4be22b797808866922b43d160715aad9bfe24784",
      "status": "passed"
    },
    {
      "batch_id": "20260904023000",
      "errors": [],
      "expected_archive_sha256": "72a5684513ca46a19d33c08e37bbd7a060de88cbcd2cdbae77b412377fc4514a",
      "first_archive_sha256": "72a5684513ca46a19d33c08e37bbd7a060de88cbcd2cdbae77b412377fc4514a",
      "first_semantic_sha256": "8e31fc566e0a344cfcafadcfe654752dbc8e0e224787ecb3f298f3dfeaa29579",
      "second_archive_sha256": "72a5684513ca46a19d33c08e37bbd7a060de88cbcd2cdbae77b412377fc4514a",
      "second_semantic_sha256": "8e31fc566e0a344cfcafadcfe654752dbc8e0e224787ecb3f298f3dfeaa29579",
      "status": "passed"
    },
    {
      "batch_id": "20260904024500",
      "errors": [],
      "expected_archive_sha256": "3ba6f9f1294d460828679289417d52a67621f4b0ca337bb4868eadbbfd43364e",
      "first_archive_sha256": "3ba6f9f1294d460828679289417d52a67621f4b0ca337bb4868eadbbfd43364e",
      "first_semantic_sha256": "d892a215b1f211043b83b4cd1e3029ee38c9a2899a0df1968e034a894ea0e4ea",
      "second_archive_sha256": "3ba6f9f1294d460828679289417d52a67621f4b0ca337bb4868eadbbfd43364e",
      "second_semantic_sha256": "d892a215b1f211043b83b4cd1e3029ee38c9a2899a0df1968e034a894ea0e4ea",
      "status": "passed"
    },
    {
      "batch_id": "20260904030000",
      "errors": [],
      "expected_archive_sha256": "b86fda57bc75cfd1a0b81cd0078f633eb5051c9fda72f94c3bf7e84a7e28bff6",
      "first_archive_sha256": "b86fda57bc75cfd1a0b81cd0078f633eb5051c9fda72f94c3bf7e84a7e28bff6",
      "first_semantic_sha256": "4a52fe9ad2a59625640459f2fd0188d95f826ebb05db79c5767c4de98d696206",
      "second_archive_sha256": "b86fda57bc75cfd1a0b81cd0078f633eb5051c9fda72f94c3bf7e84a7e28bff6",
      "second_semantic_sha256": "4a52fe9ad2a59625640459f2fd0188d95f826ebb05db79c5767c4de98d696206",
      "status": "passed"
    },
    {
      "batch_id": "20260904031500",
      "errors": [],
      "expected_archive_sha256": "b57ca2302720fd70e427f98ada7ea87da7bc810318085b610a7026786b614820",
      "first_archive_sha256": "b57ca2302720fd70e427f98ada7ea87da7bc810318085b610a7026786b614820",
      "first_semantic_sha256": "455113a4e4c081adc5a41f24bbf655df7ee4fbb8d62bd6571375d76f3ddfb14c",
      "second_archive_sha256": "b57ca2302720fd70e427f98ada7ea87da7bc810318085b610a7026786b614820",
      "second_semantic_sha256": "455113a4e4c081adc5a41f24bbf655df7ee4fbb8d62bd6571375d76f3ddfb14c",
      "status": "passed"
    },
    {
      "batch_id": "20260904033000",
      "errors": [],
      "expected_archive_sha256": "23d0a96eddd76da341fdf6f2fa07fbed6b420d40fec79c8e3bbfb5735d3ad7ad",
      "first_archive_sha256": "23d0a96eddd76da341fdf6f2fa07fbed6b420d40fec79c8e3bbfb5735d3ad7ad",
      "first_semantic_sha256": "09e4bdf59d1ba4e889890339267bb8d62077d5548911ab74c1bbb6ebcb8361cb",
      "second_archive_sha256": "23d0a96eddd76da341fdf6f2fa07fbed6b420d40fec79c8e3bbfb5735d3ad7ad",
      "second_semantic_sha256": "09e4bdf59d1ba4e889890339267bb8d62077d5548911ab74c1bbb6ebcb8361cb",
      "status": "passed"
    },
    {
      "batch_id": "20260904034500",
      "errors": [],
      "expected_archive_sha256": "ea875ce1a401ffb71c03c350ecd9f35f30466e01276a355142cd4eff42231388",
      "first_archive_sha256": "ea875ce1a401ffb71c03c350ecd9f35f30466e01276a355142cd4eff42231388",
      "first_semantic_sha256": "3338fc10de2291e26e221b55bbe60a4aade612e711ea362db40a809c2288bdc1",
      "second_archive_sha256": "ea875ce1a401ffb71c03c350ecd9f35f30466e01276a355142cd4eff42231388",
      "second_semantic_sha256": "3338fc10de2291e26e221b55bbe60a4aade612e711ea362db40a809c2288bdc1",
      "status": "passed"
    },
    {
      "batch_id": "20260904040000",
      "errors": [],
      "expected_archive_sha256": "d46eb2dafa5243119876e5728512a6e1ba7a3463fd5ea45c0c617d71afcbeb9e",
      "first_archive_sha256": "d46eb2dafa5243119876e5728512a6e1ba7a3463fd5ea45c0c617d71afcbeb9e",
      "first_semantic_sha256": "65feeff966f1de243b5f80b51034e7f9479763f95f7090b80e8024d833526964",
      "second_archive_sha256": "d46eb2dafa5243119876e5728512a6e1ba7a3463fd5ea45c0c617d71afcbeb9e",